Original,Translated
"।।4.16।। कर्म क्या है और अकर्म क्या है? इस विषय में बुद्धिमान पुरुष भी भ्रमित हो जाते हैं। इसलिये मैं तुम्हें कर्म कहूँगा,  (अर्थात् कर्म और अकर्म का स्वरूप समझाऊँगा) जिसको जानकर तुम अशुभ (संसार बन्धन) से मुक्त हो जाओगे।।",।।4.16।। कर्म क्या है और अकर्म क्या है? इस विषय में बुद्धिमान पुरुष भी भ्रमित हो जाते हैं। इसलिए मैं बंधन कर्म कहूँगा।
।।4.17।। कर्म का (स्वरूप) जानना चाहिये और विकर्म का (स्वरूप) भी जानना चाहिये ; (बोद्धव्यम्) तथा अकर्म का भी (स्वरूप) जानना चाहिये (क्योंकि) कर्म की गति गहन है।।,।।4.17।। कर्म का (सरूप) पूर्व नाम और विकर्म का (सरूप) भी जाना जाता नाम; (बोधव्यम्) तथा अकर्म का भी (स्वरूप) पता चला (क्योंकि) कर्म की गति गहरी है।
"।।4.18।। जो पुरुष कर्म में अकर्म और अकर्म में कर्म देखता है,  वह मनुष्यों में बुद्धिमान है,  वह योगी सम्पूर्ण कर्मों को करने वाला है।।","।।4.18।। जो पुरुष कर्म में अकर्म और अकर्म में कर्म दिखता है, वह विद्या में बुद्धि है, वह योगी संपूर्ण कर्मों को करने वाला है।"
"।।4.19।। जिसके समस्त कार्य कामना और संकल्प से रहित हैं,  ऐसे उस ज्ञानरूप अग्नि के द्वारा भस्म हुये कर्मों वाले पुरुष को ज्ञानीजन पण्डित कहते हैं।।","।।4.19।। जो समस्त कार्य और संकल्प से अनुपयुक्त हैं, ऐसे वह ज्ञानरूप अग्नि के द्वारा भस्म कर्मों वाले पुरुष को ज्ञानीजन पंडित कहते हैं।"
"।।4.20।। जो पुरुष,  कर्मफलासक्ति को त्यागकर,  नित्यतृप्त और सब आश्रयों से रहित है वह कर्म में प्रवृत्त होते हुए भी (वास्तव में) कुछ भी नहीं करता है।।","।।4.20।। जो पुरुष कर्मफलसक्ति को त्यागकर, नित्यतृप्त और सभी आश्रयों से अयोग्य है, वह कर्म में प्रवृत्त होता भी है (वास्तव में) कुछ भी नहीं करता है।"
"।।4.21।। जो आशा रहित है तथा जिसने चित्त और आत्मा (शरीर) को संयमित किया है,  जिसने सब परिग्रहों का त्याग किया है,  ऐसा पुरुष शारीरिक कर्म करते हुए भी पाप को नहीं प्राप्त होता है।।","।।4.21।। जो आशा अनुपयोगी है और जिसने मन और आत्मा (शरीर) को संयमित कर दिया है, जिसने सभी परिग्रहों का त्याग कर दिया है, ऐसा पुरुष-शारीरिक कर्म करने पर भी पाप प्राप्त नहीं होता है।"
"।।4.22।। यदृच्छया (अपने आप) जो कुछ प्राप्त हो उसमें ही सन्तुष्ट रहने वाला,  द्वन्द्वों से अतीत तथा मत्सर से रहित,  सिद्धि व असिद्धि में समभाव वाला पुरुष कर्म करके भी नहीं बन्धता है।।","।।4.22।। यदृच्छया (अपना आप) जो कुछ भी प्राप्त हो उसमें ही सन्तुष्ट रहने वाला, द्वन्द्वों से अतीत और मतसर से रहित, सिद्धि और असिद्धि में समभाव वाला पुरुष कर्म करके भी बंधता नहीं है।"
"।।4.23।। जो आसक्तिरहित और मुक्त है,  जिसका चित्त ज्ञान में स्थित है,  यज्ञ के लिये आचरण करने वाले ऐसे पुरुष के समस्त कर्म लीन हो जाते हैं।।","।।4.23।। जो अपवित्र और मुक्त है, जिसका चित्त ज्ञान स्थित है, यज्ञ के लिए आचरण करने वाले से उस व्यक्ति के सभी कर्म लीन हो जाते हैं।"
"।।4.24।। अर्पण (अर्थात् अर्पण करने का साधन श्रुवा) ब्रह्म है और हवि (शाकल्य अथवा हवन करने योग्य द्रव्य) भी ब्रह्म है;  ब्रह्मरूप अग्नि में ब्रह्मरूप कर्ता के द्वारा जो हवन किया गया है,  वह भी ब्रह्म ही है। इस प्रकार ब्रह्मरूप कर्म में समाधिस्थ पुरुष का गन्तव्य भी ब्रह्म ही है।।","।।4.24।। अर्पण (अर्थात् अर्पण करने का साधन श्रुवा) ब्रह्म है और हवि (शाकल्य या अर्पण करने योग्य द्रव्य) भी ब्रह्म है;  ब्रह्मरूप अग्नि में ब्रह्मरूप कर्ता के द्वारा जो रखा गया है, वह भी ब्रह्म ही है। इस प्रकार ब्रह्मरूप कर्म में समाधिस्थ पुरुष का गन्तव्य भी ब्रह्म ही है।"
।।4.25।। कोई योगीजन देवताओं के पूजनरूप यज्ञ को ही करते हैं ; और दूसरे (ज्ञानीजन) ब्रह्मरूप अग्नि में यज्ञ के द्वारा यज्ञ को हवन करते हैं।।,।।4.25।। कोई योगीजन देवताओं के पूजनरूप यज्ञ को ही करते हैं; और दूसरा (ज्ञानीजन) ब्रह्मरूप अग्नि में यज्ञ करते हैं।
"।।4.26।। अन्य (योगीजन) श्रोत्रादिक सब इन्द्रियों को संयमरूप अग्नि में हवन करते हैं,  और अन्य (लोग) शब्दादिक विषयों को इन्द्रियरूप अग्नि में हवन करते हैं।।",।।4.26।। अन्य (योगीजन) श्रोत्रादिक सभी इन्द्रियों को संयमरूप अग्नि में निवास करते हैं। और अन्य (योगीजन) शब्दादिक विषयों को इन्द्रियरूप अग्नि में निवास करते हैं।
।।4.27।। दूसरे (योगीजन) सम्पूर्ण इन्द्रियों के तथा प्राणों के कर्मों को ज्ञान से प्रकाशित आत्मसंयमयोगरूप अग्नि में हवन करते हैं।।,।।4.27।। दूसरा (योगीजन) संपूर्ण इंद्रियों के तथा प्राणों के कर्मों को ज्ञान से प्रकाशित आत्मसंयमयोगरूप अग्नि में निवास करते हैं।
"।।4.28।। कुछ (साधक) द्रव्ययज्ञ, तपयज्ञ और योगयज्ञ करने वाले होते हैं;  और दूसरे कठिन व्रत करने वाले स्वाध्याय और ज्ञानयज्ञ करने वाले योगीजन होते हैं।।","।।4.28।। कुछ (साधक) द्रव्ययज्ञ, तपयज्ञ और योगयज्ञ करने वाले होते हैं;  और अन्य कठिन व्रत करने वाले स्वाध्याय और ज्ञानयज्ञ करने वाले योगीजन होते हैं।"
"।।4.29।। अन्य (योगीजन) अपानवायु में प्राणवायु को हवन करते हैं,  तथा प्राण में अपान की आहुति देते हैं,  प्राण और अपान की गति को रोककर,  वे प्राणायाम के ही समलक्ष्य समझने वाले होते हैं।।","।।4.29।। अन्य (योगीजन) अपानवायु में प्राणवायु को प्रदर्शित करते हैं, और प्राण में अपान की आहुति देते हैं, प्राण और अपान की गति को रोकते हैं, वे प्राणायाम के ही समलक्ष्य बोध वाले होते हैं।"
"।।4.30।। दूसरे नियमित आहार करने वाले (साधक जन) प्राणों को प्राणों में हवन करते हैं। ये सभी यज्ञ को जानने वाले हैं, जिनके पाप यज्ञ के द्वारा नष्ट हो चुके हैं।।",।।4.30।। अन्य नियमित आहार करने वाले (साधक जन) प्राणों को प्राणों में रखते हैं। इन सभी यज्ञों का नाश हो गया है।
"।।4.31।। हे कुरुश्रेष्ठ ! यज्ञ के अवशिष्ट अमृत को भोगने वाले पुरुष सनातन ब्रह्म को प्राप्त होते हैं। यज्ञ रहित पुरुष को यह लोक भी नहीं मिलता,  फिर परलोक कैसे मिलेगा?","।।4.31।। हे कुरुश्रेष्ठ ! यज्ञ के अविशिष्ट अमृत को भोगने वाले पुरुष सनातन ब्रह्म को प्राप्त होते हैं। यज्ञोपवीत पुरुष को यह लोक भी नहीं, फिर परलोक कैसे मिलेगा?"
।।4.32।। ऐसे अनेक प्रकार के यज्ञों का ब्रह्मा के मुख अर्थात् वेदों में प्रसार है अर्थात् वर्णित हैं। उन सब को कर्मों से उत्पन्न हुए जानो;  इस प्रकार जानकर तुम मुक्त हो जाओगे।।,।।4.32।। ऐसे अनेक प्रकार के यज्ञों के ब्रह्मा के मुख वेदों में वर्णित हैं। उन सब को कर्मों से उत्पन्न हुए जानो;  इस प्रकार जानें आप मुक्त हो जाएं।
"।।4.33।। हे परन्तप ! द्रव्यों से सम्पन्न होने वाले यज्ञ की अपेक्षा ज्ञानयज्ञ श्रेष्ठ है। हे पार्थ ! सम्पूर्ण अखिल कर्म ज्ञान में समाप्त होते हैं,  अर्थात् ज्ञान उनकी पराकाष्ठा है।।","।।4.33।। हे परन्तप! द्रव्यों से संकलित यज्ञ की विशेषता ज्ञानयज्ञ श्रेष्ठ है। हे पार्थ! संपूर्ण कर्म ज्ञान समाप्त हो जाता है, अर्थात ज्ञान उनकी पराकाष्ठा है।"
"।।4.34।। उस (ज्ञान) को (गुरु के समीप जाकर) साष्टांग प्रणिपात,  प्रश्न तथा सेवा करके जानो;  ये तत्त्वदर्शी ज्ञानी पुरुष तुम्हें ज्ञान का उपदेश करेंगे।।","।।4.34।। उस (ज्ञान) को (गुरु के निकट दृष्टि) साष्टांग प्रनिपात, प्रश्न तथा सेवा करके जानो;  ये तत्त्वदर्शन ज्ञानी पुरुष सार ज्ञान का उपदेश।।"
"।।4.35।। जिसको जानकर तुम पुन इस प्रकार मोह को नहीं प्राप्त होगे,  और हे पाण्डव ! जिसके द्वारा तुम भूतमात्र को अपने आत्मस्वरूप में तथा मुझमें भी देखोगे।।","।।4.35।। यह जानकर तुम्हें पुन: इस प्रकार का मोह प्राप्त नहीं होगा, और हे पाण्डव ! जो तुम भूतमात्र को अपने आत्मस्वरूप में और मुझमें भी देखोगे।"
"।।4.36।। यदि तुम सब पापियों से भी अधिक पाप करने वाले हो,  तो भी ज्ञानरूपी नौका द्वारा,  निश्चय ही सम्पूर्ण पापों का तुम संतरण कर जाओगे।।","।।4.36।। यदि तुम सभी पापियों से भी अधिक पाप करने वाले हो, तो भी ज्ञानरूपी नाव से, यही संपूर्ण पापों का तुम संतन कर सकते हो।"
"।।4.37।। जैसे प्रज्जवलित अग्नि ईन्धन को भस्मसात् कर देती है,  वैसे ही,  हे अर्जुन ! ज्ञानरूपी अग्नि सम्पूर्ण कर्मों को भस्मसात् कर देती है।।","।।4.37।। जैसे प्रज्वलित अग्नि इंधन को भस्मसात् कर दिया है, वैसे ही, हे अर्जुन ! ज्ञानरूपी अग्नि संपूर्ण कर्मों को भस्म करती है।"
"।।4.38।। इस लोक में ज्ञान के समान पवित्र करने वाला,  निसंदेह,  कुछ भी नहीं है। योग में संसिद्ध पुरुष स्वयं ही उसे (उचित) काल में आत्मा में प्राप्त करता है।।","।।4.38।। इस लोक में ज्ञान के समान पवित्र करने वाला, निसंदेह, कुछ भी नहीं है। योग में संसिद्ध पुरुष स्वयं ही उसे (उचित) काल में आत्मा प्राप्त करता है।"
"।।4.39।। श्रद्धावान्,  तत्पर और जितेन्द्रिय पुरुष ज्ञान प्राप्त करता है। ज्ञान को प्राप्त करके शीघ्र ही वह परम शान्ति को प्राप्त होता है।।","।।4.39।। श्रद्धावान्, तत्पर एवं मनोचिकित्सक पुरुष ज्ञान प्राप्त होता है। ज्ञान को शीघ्र ही प्राप्त करके परम शांति को प्राप्त किया जाता है।"
"।।4.40।। अज्ञानी तथा श्रद्धारहित और संशययुक्त पुरुष नष्ट हो जाता है,  (उनमें भी) संशयी पुरुष के लिये न यह लोक है,  न परलोक और न सुख।।","।।4.40।। अज्ञानी तथा श्रद्धारहित और संशययुक्त पुरुष नष्ट हो जाता है, (इनमें भी) संशयी पुरुष के लिए न यह लोक है, नलोक और न सुख।।"
"।।4.41।। जिसने योगद्वारा कर्मों का संन्यास किया है,  ज्ञानद्वारा जिसके संशय नष्ट हो गये हैं,  ऐसे आत्मवान् पुरुष को,  हे धनंजय ! कर्म नहीं बांधते हैं।।","।।4.41।। जो योग द्वारा निर्मित कर्मों का संत है, ज्ञान द्वारा संशय नष्ट हो गया है, ऐसे आत्मवान पुरुष को, हे धनंजय ! कर्म नहीं बांधते हैं।।"
"।।4.42।। इसलिये अपने हृदय में स्थित अज्ञान से उत्पन्न आत्मविषयक संशय को ज्ञान खड्ग से काटकर,  हे भारत ! योग का आश्रय लेकर खड़े हो जाओ।।","।।4.42।। इसलिए आपके हृदय में स्थित अज्ञान से उत्पन्न आत्मविषयक संशय को ज्ञान खड्ग से विखंडित, हे भारत ! योग का सहारा लेकर बने रहें।"
"।।5.1।। अर्जुन ने कहा हे --  कृष्ण ! आप कर्मों के संन्यास की और फिर योग (कर्म के आचरण) की प्रशंसा करते हैं। इन दोनों में एक जो निश्चय पूर्वक श्रेयस्कर है, उसको मेरे लिए कहिये।।","।।5.1।। अर्जुन ने कहा हे--कृष्ण ! आप कर्मों के संत और फिर योग (कर्म के आचरण) की प्रशंसा करते हैं। इन दोनों में एक जो कहा गया है वह है श्रेयस्कर, उपयोग के लिए कहें।"
।।5.2।। श्रीभगवान् ने कहा --  कर्मसंन्यास और कर्मयोग ये दोनों ही परम कल्याणकारक हैं;  परन्तु उन दोनों में कर्मसंन्यास से कर्मयोग श्रेष्ठ है।।,।।5.2।। भगवान श्री ने कहा -- कर्मसंन्यास और कर्मयोग ये दोनों ही परम कल्याणकारक हैं;  लेकिन इन दोनों में कर्मसंन्यास से कर्मयोग श्रेष्ठ है।
"।।5.3।। जो पुरुष न किसी से द्वेष करता है और न किसी की आकांक्षा,  वह सदा संन्यासी ही समझने योग्य है;  क्योंकि,  हे महाबाहो ! द्वन्द्वों से रहित पुरुष सहज ही बन्धन मुक्त हो जाता है।।","।।5.3।। जो पुरुष न किसी से द्वेष करता है और न किसी का उद्धार करता है, वह सदा संत ही साधन योग्य है;  क्योंकि, हे महाबाहो ! द्वंद्वों से अनुपयुक्त पुरुष सहज ही बंधन मुक्त हो जाता है।"
।।5.4।। बालक अर्थात् बालबुद्धि के लोग सांख्य (संन्यास) और योग को परस्पर भिन्न समझते हैं;  किसी एक में भी सम्यक् प्रकार से स्थित हुआ पुरुष दोनों के फल को प्राप्त कर लेता है।।,।।5.4।। बालक अर्थात् बालबुद्धि के लोग सांख्य (संन्यास) और योग के अभिन्न अंग हैं;  किसी एक में भी सम्यक् प्रकार से स्थित पुरुष दोनों के फल प्राप्त हो सकते हैं।
"।।5.5।। जो स्थान ज्ञानियों द्वारा प्राप्त किया जाता है,  उसी स्थान पर कर्मयोगी भी पहुँचते हैं। इसलिए जो पुरुष सांख्य और योग को (फलरूप से) एक ही देखता है,  वही (वास्तव में) देखता है।।","।।5.5।। जो स्थान ज्ञानियों द्वारा प्राप्त किया जाता है, उसी स्थान पर कर्मयोगी भी प्राप्त करते हैं। इसलिए जो पुरुष साख और योग को (फलरूप से) एक ही दृष्टि देता है, वही (वास्तव में) दृष्टि है।"
