Original,Translated
।।9.10।। हे कौन्तेय ! मुझ अध्यक्ष के कारण ( अर्थात् मेरी अध्यक्षता में) प्रकृति चराचर जगत् को उत्पन्न करती है; इस कारण यह जगत् घूमता रहता है।।,।।9.10।। हे कौन्तेय ! मुझ राष्ट्रपति के कारण (अर्थात् मेरी राष्ट्रपति पद के लिए) प्रकृति चराचर जगत् उत्पन्न होती है; इस कारण यह जगत् घूमता रहता है।
।।9.11।। समस्त भूतों के महान् ईश्वर रूप मेरे परम भाव को नहीं जानते हुए मूढ़ लोग मनुष्य शरीरधारी मुझ परमात्मा का अनादर करते हैं।।,।।9.11।। समस्त भूतों के महान ईश्वर रूप मेरे परम भाव को नहीं जानते मूढ़ मनुष्य मनुष्य शरीरधारी मुझ ईश्वर का अनादर करते हैं।
"।।9.12।। वृथा आशा, वृथा कर्म और वृथा ज्ञान वाले अविचारीजन राक्षसों के और असुरों के मोहित करने वाले स्वभाव को धारण किये रहते हैं।।","।।9.12।। वृथा आशा, वृथा कर्म और वृथा ज्ञान वाले अविचारजन राक्षसों के और असुरों के मोहित करने वाले स्वभाव को धारण करते हैं।"
।।9.13।। हे पार्थ ! परन्तु दैवी प्रकृति के आश्रित महात्मा पुरुष मुझे समस्त भूतों का आदिकारण और अव्ययस्वरूप जानकर अनन्यमन से युक्त होकर मुझे भजते हैं।।,।।9.13।। हे पार्थ! परन्तु दैवी प्रकृति के महान महात्मा पुरुष मुझे समस्त भूतों का आदिकरण और अव्ययस्वरूप जानने वाले अनन्यमन से युक्त होकर मुझे भजते हैं।
"।।9.14।। सतत मेरा कीर्तन करते हुए, प्रयत्नशील, दढ़व्रती पुरुष मुझे नमस्कार करते हुए, नित्ययुक्त होकर भक्तिपूर्वक मेरी उपासना करते हैं।।","।।9.14।। लगातार मेरा कीर्तन करते रहो, प्रयास करते रहो, व्रती पुरुष मुझे नमस्कार करते रहो, नित्ययुक्त तुम्हारी भक्ति मेरी पूजा करते रहो।।"
"।।9.15।। कोई मुझे ज्ञानयज्ञ के द्वारा पूजन करते हुए एकत्वभाव से उपासते हैं, कोई पृथक भाव से, कोई बहुत प्रकार से मुझ विराट स्वरूप (विश्वतो मुखम्) को उपासते हैं।।","9.15. कोई मुझे ज्ञानयज्ञ के द्वारा पूजते हुए एकत्वभाव से उपासते हैं, कोई अलग भाव से, कोई बहुत प्रकार से मुझ विराट स्वरूप (विश्वतो मुखम्) को उपासते हैं।"
"।।9.16।। मैं ऋक्रतु हूँ; मैं यज्ञ हूँ; स्वधा और औषध मैं हूँ, मैं मन्त्र हूँ, घी हूँ, मैं अग्नि हूँ और हुतं अर्थात् हवन कर्म मैं हूँ।।","।।9.16।। मैं ऋक्रतु हूँ; मैं यज्ञ हूँ; स्वधा और औषधि मैं हूं, मैं मंत्र हूं, घी हूं, मैं अग्नि हूं और हुतं अर्थात घर कर्म मैं हूं।।"
"।।9.17।। मैं ही इस जगत् का पिता, माता, धाता (धारण करने वाला) और पितामह हूँमैं वेद्य (जानने योग्य) वस्तु हूँ, पवित्र, ओंकार, ऋग्वेद, सामवेद और यजुर्वेद भी मैं ही हूँ।।","।।9.17।। मैं ही इस जगत का पिता, माता, धाता (धारण करने वाला) और पितामह मैं वेद्य (जानने योग्य) वस्तु हूं, पवित्र, ओंकार, ऋग्वेद, सामवेद और यजुर्वेद भी हूं।"
"।।9.18।। गति (लक्ष्य), भरण-पोषण करने वाला, प्रभु (स्वामी), साक्षी, निवास, शरणस्थान तथा मित्र और उत्पत्ति, प्रलयरूप तथा स्थान (आधार), निधान और अव्यय कारण भी मैं हूँ।।","9.18. गति (लक्ष्य), भरण-पोषण करने वाला, प्रभु (स्वामी), साक्षी, निवास, शरणस्थान तथा मित्र और उत्पत्ति, प्रलयरूप तथा स्थान (आधार), निधान और अव्यय भी कारण मैं हूँ।"
।।9.19।। हे अर्जुन ! मैं ही (सूर्य रूप में) तपता हूँ; मैं वर्षा का निग्रह और उत्सर्जन करता हूँ। मैं ही अमृत और मृत्यु एवं सत् और असत् हूँ।।,9.19. हे अर्जुन ! मैं ही (सूर्य रूप में) तपता हूँ; मैं वर्षा का निग्रह और काम करता हूँ। मैं ही अमृत और मृत्यु एवं सत् और असत् हूं।।
"।।9.20।। तीनों वेदों के ज्ञाता (वेदोक्त सकाम कर्म करने वाले), सोमपान करने वाले एवं पापों से पवित्र हुए पुरुष मुझे यज्ञों के द्वारा पूजकर स्वर्ग प्राप्ति चाहते हैं; वे पुरुष अपने पुण्यों के फलरूप इन्द्रलोक को प्राप्त कर स्वर्ग में दिव्य देवताओं के भोग भोगते हैं।।","9.20. त्रिवेदों के ज्ञाता (वेदोक्त सकाम कर्म करने वाले), सोमपान करने वाले एवं पापों से पवित्र पुरुष मुझे यज्ञों के द्वारा पूजकर स्वर्ग प्राप्त करना चाहते हैं; वे पुरुष अपने पुण्यों के फल रूप इंद्रलोक को प्राप्त कर स्वर्ग में दिव्य देवताओं के भोग भोगते हैं।"
"।।9.21।। वे उस विशाल स्वर्गलोक को भोगकर, पुण्यक्षीण होने पर, मृत्युलोक को प्राप्त होते हैं। इस प्रकार तीनों वेदों में कहे गये कर्म के शरण हुए और भोगों की कामना वाले पुरुष आवागमन (गतागत) को प्राप्त होते हैं।।","।।9.21।। वे उस विशाल स्वर्गलोक को भोगकर, पुण्यप्राप्ति पर, मृत्युलोक को प्राप्त होते हैं। इस प्रकार तीन वेदों में कहे गए कर्म के शरण प्राप्त होते हैं और भोगों की कामना वाले पुरुष शीर्षक (गतागत) प्राप्त होते हैं।"
"।।9.22।। अनन्य भाव से मेरा चिन्तन करते हुए जो भक्तजन मेरी ही उपासना करते हैं, उन नित्ययुक्त पुरुषों का योगक्षेम मैं वहन करता हूँ।।","।।9.22।। अनन्य भाव से मेरा चिंतन करते हैं जो भक्तजन मेरी ही पूजा करते हैं, वे नित्ययुक्त पुरुषों का योगक्षेम मैं वह करता हूं।"
"।।9.23।। हे कौन्तेय ! श्रद्धा से युक्त जो भक्त अन्य देवताओं को पूजते हैं, वे भी मुझे ही अविधिपूर्वक पूजते हैं।।","।।9.23।। हे कौन्तेय ! श्रद्धा से युक्त जो भक्त अन्य देवताओं को पूजते हैं, वे भी मुझे ही अविधि से पूजते हैं।।"
"।।9.24।। क्योंकि सब यज्ञों का भोक्ता और स्वामी मैं ही हूँ, परन्तु वे मुझे तत्त्वत: नहीं जानते हैं, इसलिए वे गिरते हैं, अर्थात् संसार को प्राप्त होते हैं।।","।।9.24।। क्योंकि सभी यज्ञों का भोक्ता और स्वामी मैं ही हूं, लेकिन वे मुझे तत्त्वत: नहीं जानते, इसलिए वे श्रेणीबद्ध हैं, अर्थात् संसार को प्राप्त होते हैं।"
"।।9.25।। देवताओं के पूजक देवताओं को प्राप्त होते हैं, पितरपूजक पितरों को जाते हैं, भूतों का यजन करने वाले भूतों को प्राप्त होते हैं और मुझे पूजने वाले भक्त मुझे ही प्राप्त होते हैं।।","।।9.25।। देवताओं के पूजक देवता प्राप्त होते हैं, पितृपूजक पितरों को मिलते हैं, भूतों का यज्ञ करने वाले भूतों को प्राप्त होते हैं और मुझे पूजने वाले भक्त मुझे ही प्राप्त होते हैं।"
"।।9.26।। जो कोई भी भक्त मेरे लिए पत्र, पुष्प, फल, जल आदि भक्ति से अर्पण करता है, उस शुद्ध मन के भक्त का वह भक्तिपूर्वक अर्पण किया हुआ (पत्र पुष्पादि) मैं भोगता हूँ अर्थात् स्वीकार करता हूँ।।","।।9.26।। जो कोई भी भक्त मेरे लिए पत्र, पुष्प, फल, जल आदि भक्ति से अर्पण करता है, उस शुद्ध मन के भक्त का वह भक्ति से अर्पण करता है (पत्र पुष्पादि) मैं भोगता हूँ।"
"।।9.27।। हे कौन्तेय ! तुम जो कुछ कर्म करते हो, जो कुछ खाते हो, जो कुछ हवन करते हो, जो कुछ दान देते हो और जो कुछ तप करते हो, वह सब तुम मुझे अर्पण करो।।","।।9.27।। हे कौन्तेय ! जो कुछ कर्म करो, जो तुम कुछ करो, जो कुछ तुम करो, जो कुछ दान करो और जो कुछ टैप करो, वह सब तुम मुझे अर्पित करो।।"
।।9.28।। इस प्रकार तुम शुभाशुभ फलस्वरूप कर्मबन्धनों से मुक्त हो जाओगे; और संन्यासयोग से युक्तचित्त हुए तुम विमुक्त होकर मुझे ही प्राप्त हो जाओगे।।,।।9.28।। इस प्रकार आप शुभाशुभ व्यवसाय बंधनों से मुक्त हो जाएं; और संतयोग से युक्तचित्त हुए तुम विमुक्त होकर मुझे ही प्राप्त हुए।।
"।।9.29।। मैं समस्त भूतों में सम हूँ; न कोई मुझे अप्रिय है और न प्रिय; परन्तु जो मुझे भक्तिपूर्वक भजते हैं, वे मुझमें और मैं भी उनमें हूँ।।","।।9.29।। मैं सभी भूतों में सम हूँ; न कोई उल्लेख सुन्दर और न प्रिय है; परन्तु जो मुझे भक्ति अयोग्य भजते हैं, वे मुझमें और मैं भी उनको हूं।।"
"।।9.30।। यदि कोई अतिशय दुराचारी भी अनन्यभाव से मेरा भक्त होकर मुझे भजता है, वह साधु ही मानने योग्य है, क्योंकि वह यथार्थ निश्चय वाला है।।","।।9.30।। यदि कोई अतिशय दुराचारी भी मेरे भक्त से अनन्यभाव से मुझे भजता है, तो वह साधु ही घटित होता है, क्योंकि वह वास्तविक मूल्य वाला है।"
"।।9.31।। हे कौन्तेय, वह शीघ्र ही धर्मात्मा बन जाता है और शाश्वत शान्ति को प्राप्त होता है। तुम निश्चयपूर्वक सत्य जानो कि मेरा भक्त कभी नष्ट नहीं होता।।","।।9.31।। हे कौन्तेय, वह शीघ्र ही धर्मात्मा बन जाता है और शाश्वत शांति प्राप्त होती है। निश्चय तुम संदेह सत्य जानो कि मेरा भक्त कभी नष्ट नहीं होता।।"
"।।9.32।। हे पार्थ ! स्त्री, वैश्य और शूद्र ये जो कोई पापयोनि वाले हों, वे भी मुझ पर आश्रित (मेरे शरण) होकर परम गति को प्राप्त होते हैं।।","।।9.32।। हे पार्थ! स्त्री, वैश्य और शूद्र ये जो कोई पापयोनि वाले हैं, वे भी मुझ पर आश्रित (मेरे शरण) ही परम गति को प्राप्त होते हैं।"
।।9.33।। फिर क्या कहना है कि पुण्यशील ब्राह्मण और राजर्षि भक्तजन (परम गति को प्राप्त होते हैं); (इसलिए) इस अनित्य और सुखरहित लोक को प्राप्त होकर (अब) तुम भक्तिपूर्वक मेरी ही पूजा करो।।,।।9.33।। फिर क्या कहा गया है कि पुण्यशील ब्राह्मण और राजर्षि भक्तजन (परम गति को प्राप्त होते हैं); (इसलिए) इस अनित्य और सुखरहित लोक को प्राप्त करें (अब) तुम भक्ति देखो मेरी ही पूजा करो।।
।।9.34।। (तुम) मुझमें स्थिर मन वाले बनो; मेरे भक्त और मेरे पूजन करने वाले बनो; मुझे नमस्कार करो; इस प्रकार मत्परायण (अर्थात् मैं ही जिसका परम लक्ष्य हूँ ऐसे) होकर आत्मा को मुझसे युक्त करके तुम मुझे ही प्राप्त होओगे।।,।।9.34।। (तुम) मुझमें स्थिर मन वाले बनो; मेरे भक्त और मेरे पूजने वाले बनो; मुझे नमस्कार करो; इस प्रकार मत्परायण (अर्थ मैं ही परम लक्ष्य हूं ऐसे) वाणी आत्मा को मेरे द्वारा युक्त करके तुम मुझे ही प्राप्त करोगे।।
"।।10.1।। श्रीभगवान् ने कहा -- हे महाबाहो ! पुन: तुम मेरे परम वचनों का श्रवण करो, जो मैं तुझ अतिशय प्रेम रखने वाले के लिये हित की इच्छा से कहूँगा।।","।।10.1।। भगवान श्री ने कहा -- हे महाबाहो ! पुन: तुम मेरे परम वचनों का श्रवण करो, जो मैं तुम्हें अतिशय प्रेम बनाए रखने वाले के लिए हित की इच्छा से कहूँगा।"
।।10.2।। मेरी उत्पत्ति (प्रभव) को न देवतागण जानते हैं और न महर्षिजन; क्योंकि मैं सब प्रकार से देवताओं और महर्षियों का भी आदिकारण हूँ।।,।।10.2।। मेरी उत्पत्ति (प्रभव) को न देवता जानते हैं और न ही रहस्य; क्योंकि मैं सभी प्रकार के देवताओं और महर्षियों का भी आदिकरण हूँ।
"।।10.3।। जो मुझे अजन्मा, अनादि और लोकों के महान् ईश्वर के रूप में जानता है, र्मत्य मनुष्यों में ऐसा संमोहरहित (ज्ञानी) पुरुष सब पापों से मुक्त हो जाता है।।","।।10.3।। जो मुझे अजन्मा, अनादि और लोकों के महान ईश्वर के रूप में जानता है, ईश्वरीय ज्ञान में ऐसा संमोहित (ज्ञानी) पुरुष सभी पापों से मुक्त हो जाता है।"
"।।10.4।। बुद्धि, ज्ञान, मोह का अभाव, क्षमा, सत्य, दम (इन्द्रिय संयम), शम (मन: संयम), सुख, दु:ख, जन्म और मृत्यु, भय और अभय।।","।।10.4।। बुद्धि, ज्ञान, मोह का अभाव, क्षमा, सत्य, दम (इंद्रिय संयम), शम (मन: संयम), सुख, दु:ख, जन्म और मृत्यु, भय और अभय।।"
"।।10.5।। अहिंसा, समता, सन्तोष, तप, दान. यश और अपयश ऐसे ये प्राणियों के नानाविध भाव मुझ से ही प्रकट होते हैं।।","।।10.5।। अहिंसा, समता, संतोष, तप, दान। यश और अपयश ऐसे ये मश्वरे के नानाविध भाव मुझ से ही प्रकट होते हैं।।"
"।।10.6।। सात महर्षिजन, पूर्वकाल के चार (सनकादि) तथा (चौदह) मनु ये मेरे प्रभाव वाले मेरे संकल्प से उत्पन्न हुए हैं, जिनकी संसार (लोक) में यह प्रजा है।।","।।10.6।। सात महर्षिजन, पूर्वकाल के चार (सनकादि) और (चौदह) मनु ये मेरे प्रभाव वाले मेरे संकल्प से उत्पन्न हुए हैं,क्रोम संसार (लोक) में यह प्रजा है।।"
"।।10.7।। जो पुरुष इस मेरी विभूति और योग को तत्त्व से जानता है, वह पुरुष अविकम्प योग (अर्थात् निश्चल ध्यान योग) से युक्त हो जाता है, इसमें कुछ भी संशय नहीं है।।","।।10.7।। जो पुरुष इस मेरी विभूति और योग को तत्त्व से जानता है, वह पुरुष अविकंप योग (अर्थात निश्चल ध्यान योग) से युक्त हो जाता है, इसमें कुछ भी संशय नहीं है।"
"।।10.8।। मैं ही सबका प्रभव स्थान हूँ; मुझसे ही सब (जगत्) विकास को प्राप्त होता है, इस प्रकार जानकर बुधजन भक्ति भाव से युक्त होकर मुझे ही भजते हैं।।","।।10.8।। मैं ही सबका प्रभव स्थान हूँ; मेरे ही सब (जगत) विकास को प्राप्त होता है, इस प्रकार ज्ञान बुधजन भक्ति भाव से युक्त होकर मुझे ही भजते हैं।"
