Original,Translated
।।1.1।।धृतराष्ट्र ने कहा -- हे संजय ! धर्मभूमि कुरुक्षेत्र में एकत्र हुए युद्ध के इच्छुक (युयुत्सव:) मेरे और पाण्डु के पुत्रों ने क्या किया?,।।1.1।।धृतराष्ट्र ने कहा -- हे संजय ! धर्मभूमि कुरूक्षेत्र में सम्मिलित युद्ध के उद्देश्य (युयुत्सव:) मेरे और पाण्डु के पुत्रों ने क्या किया?
।।1.2।।संजय ने कहा -- पाण्डव-सैन्य की व्यूह रचना देखकर राजा दुर्योधन ने आचार्य द्रोण के पास जाकर ये वचन कहे।,1.2.संजय ने कहा--पांडव-सैन्य की दृष्टि रचना राजा दुर्योधन ने आचार्य द्रोण के पास ये वचन कहे।
।।1.3।।हे आचार्य ! आपके बुद्धिमान शिष्य द्रुपदपुत्र (धृष्टद्द्युम्न) द्वारा व्यूहाकार खड़ी की गयी पाण्डु पुत्रों की इस महती सेना को देखिये।,।।1.3।।हे आचार्य ! आपके विद्वान शिष्य द्रुपदपुत्र (धृष्टद्युम्न) द्वारा देखे गए दृश्यहाकार शिखर की ली गई पांडु पुत्रों की इस महती सेना को देखें।
"।।1.4।।इस सेना में महान् धनुर्धारी शूर योद्धा है ,  जो युद्ध में भीम और अर्जुन के समान हैं , जैसे --  युयुधान, विराट तथा महारथी राजा द्रुपद।","1.4.इस सेना में महान धनुर्धारी शूरवीर हैं, जो युद्ध में भीम और अर्जुन के समान हैं, -- युयुधान, विराट और महारथी राजा द्रुपद के समान हैं।"
"।।1.5।।धृष्टकेतु, चेकितान, बलवान काशिराज,  पुरुजित्, कुन्तिभोज और मनुष्यों में श्रेष्ठ शैब्य।","।।1.5।।धृष्टकेतु, चेकितान,वान् काशीराज, पुरुजित्, कुंतिभोज और उपदेश में श्रेष्ठ साहब बल्य।"
"।।1.6।।पराक्रमी युधामन्यु,  बलवान् उत्तमौजा,  सुभद्रापुत्र (अभिमन्यु) और द्रोपदी के पुत्र -- ये सब महारथी हैं।","।।1.6।।पराक्रमी युधामन्यु, बलवान उत्तमौजा, सुभद्रापुत्र (अभिमन्यु) और द्रौपदी के पुत्र - ये सब महारथी हैं।"
"।।1.7।।हे द्विजोत्तम ! हमारे पक्ष में भी जो विशिष्ट योद्धागण हैं , उनको आप जान लीजिये; आपकी जानकारी के लिये अपनी सेना के नायकों के नाम मैं आपको बताता हूँ।","।।1.7।।हे द्विजोत्तम ! हमारे पक्ष में भी जो विशिष्ट वॉर्डरोब हैं, आप जान लें; आपकी जानकारी के लिए मैं आपको अपनी सेना के नायकों के नाम बताता हूं।"
"।।1.8।।एक तो स्वयं आप, भीष्म, कर्ण, और युद्ध विजयी कृपाचार्य तथा अश्वत्थामा, विकर्ण और सोमदत्त का पुत्र है।","।।1.8।।एक तो स्वयं आप, भीष्म, कर्ण और युद्ध के विजयी कृपाचार्य तथा अश्वत्थामा, विकर्ण और सोमदत्त के पुत्र हैं।"
"।।1.9।।मेरे लिए प्राण त्याग करने के लिए तैयार, अनेक प्रकार के शस्त्रास्त्रों से सुसज्जित तथा युद्ध में कुशल और भी अनेक शूर वीर हैं।","।।1.9।।मेरे लिए प्राण त्यागने की तैयारी, अनेक प्रकार के शस्त्रास्त्रों से लेकर युद्ध में कुशल और अनेक शूर वीर भी हैं।"
"।।1.10।।भीष्म के द्वारा हमारी रक्षित सेना अपर्याप्त है; किन्तु भीम द्वारा रक्षित उनकी सेना पर्याप्त है अथवा, भीष्म के द्वारा रक्षित हमारी सेना अपरिमित है किन्तु भीम के द्वारा रक्षित उनकी सेना परिमित ही है।","..1.10..भीष्म के द्वारा हमारी रक्षित सेना के खिलाड़ी हैं; बुरा भीम के पास अपनी सेना की सुरक्षा है या, भीष्म के पास अपनी सेना की सुरक्षा है।"
।।1.11।।विभिन्न मोर्चों पर अपने-अपने स्थान पर स्थित रहते हुए आप सब लोग भीष्म पितामह की ही सब ओर से रक्षा करें।,।।1.11।।विभिन्न मोर्चों पर अपने-अपने स्थान पर स्थित रहते हुए आप सभी लोग भीष्म पितामह की ही सब ओर से रक्षा करें।
"।।1.12।।उस समय कौरवों में वृद्ध, प्रतापी पितामह भीष्म ने उस (दुर्योधन) के हृदय में हर्ष उत्पन्न करते हुये उच्च स्वर में गरज कर शंखध्वनि की।","।।1.12।।उस समय कौरवों में वृद्ध, प्रतापी पितामह भीष्म ने उस (दुर्योधन) के हृदय में कठोर तरंगें बनाईं, उच्च स्वर में गर्जना कर शंखध्वनि की।"
"।।1.13।।तत्पश्चात् शंख, नगारे, ढोल व शृंगी आदि वाद्य एक साथ ही बज उठे, जिनका बड़ा भयंकर शब्द हुआ।","।।1.13।।तत्पश्चात् शंख, नगारे, ढोल व श्रृंगी आदि वाद्य एक साथ ही बज उठे, जैसे बड़ा भयंकर शब्द हुआ।"
।।1.14।।इसके उपरान्त श्वेत अश्वों से युक्त भव्य रथ में बैठे हुये माधव (श्रीकृष्ण) और पाण्डुपुत्र अर्जुन ने भी अपने दिव्य शंख बजाये।,।।1.14।। इनके ऊपरवर्ती श्वेत अश्वों से युक्त भव्य रथों में विराजमान माधव (श्रीकृष्ण) और पाण्डुपुत्र अर्जुन ने भी अपने दिव्य शंख की जगह ली।
"।।1.15।।भगवान् हृषीकेश ने पांचजन्य, धनंजय (अर्जुन) ने देवदत्त तथा भयंकर कर्म करने वाले भीम ने पौण्डू नामक महाशंख बजाया।","।।1.15।।भगवान् हृषीकेश ने पांचजन्य, धनंजय (अर्जुन) ने देवदत्त तथा भयंकर कर्म करने वाले भीम ने पौण्डु नामक महाशंख बजाया।"
।।1.16।।कुन्तीपुत्र राजा युधिष्ठिर ने अनन्त विजय नामक शंख और नकुल व सहदेव ने क्रमश:  सुघोष और मणिपुष्पक नामक शंख बजाये।,।।1.16।।कुन्तीपुत्र राजा युधिष्ठिर ने शंख नामक अनन्त विजय प्राप्त की और नकुल व सहदेव ने विनोद: सुघोष तथा मणिपुष्प नामक शंख बजाये।
"।।1.17।।श्रेष्ठ धनुषवाले काशिराज, महारथी शिखण्डी, धृष्टद्युम्न,  राजा विराट और अजेय सात्यकि।","।।1.17।।श्रेष्ठ धनुरावाले काशीराज, महारथी शिखंडी, धृष्टद्युम्न, राजा विराट और अजेय सात्यकि।"
"।।1.18।।हे राजन् ! राजा द्रुपद,  द्रौपदी के पुत्र और महाबाहु सौभद्र (अभिमन्यु) इन सब ने अलग-अलग शंख बजाये।","।।1.18।।हे राजन् ! राजा द्रुपद, द्रौपदी के पुत्र और महाबाहु सौभद्र (अभिमन्यु) इन सभी ने अलग-अलग शंख बजाये।"
।।1.19।।वह भयंकर घोष आकाश और पृथ्वी पर गूँजने लगा और उसने धृतराष्ट्र के पुत्रों के हृदय विदीर्ण कर दिये।,।।1.19।।वह भयंकर घोष आकाश और पृथ्वी पर गूंजने लगा और उसने धृतराष्ट्र के पुत्रों के हृदय को विदीर्ण कर दिया।
।।1.20।।हे महीपते ! इस प्रकार जब युद्ध प्रारम्भ होने वाला ही था कि कपिध्वज अर्जुन ने धृतराष्ट्र के पुत्रों को स्थित देखकर धनुष उठाकर भगवान् हृषीकेश से ये शब्द कहे।,।।1.20।।हे महीपते ! इस प्रकार जब युद्ध के मैदान में कपिध्वज अर्जुन ने धृतराष्ट्र के पुत्रों को स्थित देखकर धनुर्धर भगवान हृषिकेश से यह शब्द कहा था।
।।1.21।।अर्जुन ने कहा -- हे! अच्युत मेरे रथ को दोनों सेनाओं के मध्य खड़ा कीजिये।,।।1.21।।अर्जुन ने कहा--हे! अच्युत मेरे रथ को दोनों ने मध्य में खड़ा कर दिया।
।।1.22।।जिससे मैं युद्ध की इच्छा से खड़े इन लोगों का निरीक्षण कर सकूँ कि इस युद्ध में मुझे किनके साथ युद्ध करना है।,"।।1.22।।जिससे मैं युद्ध की इच्छा रखता हूं, इन लोगों का निरीक्षण कर सकता हूं कि इस युद्ध में मेरे साथ युद्ध करना है।"
"।।1.23।।दुर्बुद्धि धार्तराष्ट्र (दुर्योधन) का युद्ध में प्रिय चाहने वाले जो ये राजा लोग यहाँ एकत्र हुए हैं, उन युद्ध करने वालों को मैं देखूँगा।","।।1.23।दुर्बुद्धि धार्तराष्ट्र (दुर्योधन) के युद्ध में प्रिय साझा वाले जो ये राजा लोग यहां एकत्र हुए थे, उन युद्ध करने वालों को मैं देखूंगा।"
।।1.24।।संजय ने कहा -- हे भारत (धृतराष्ट्र) ! अर्जुन के इस प्रकार कहने पर भगवान् हृषीकेश ने दोनों सेनाओं के मध्य उत्तम रथ को खड़ा करके।,।।1.24।।संजय ने कहा -- हे भारत (धृतराष्ट्र) ! अर्जुन के इस कथन के अनुसार भगवान हृषिकेश ने दोनों सेनाओं के मध्य उत्तम रथ को खड़ा करके दिखाया।
"।।1.25।। भीष्म, द्रोण तथा पृथ्वी के समस्त शासकों के समक्ष उन्होंने कहा, ""हे पार्थ यहाँ एकत्र हुये कौरवों को देखो""।","।।1.25।। भीष्म, द्रोण और पृथ्वी के सभी शासकों के बारे में उन्होंने कहा, ""हे पार्थ यहाँ एक साथ कौरवों को देखो""।"
"।।1.26।।वहाँ अर्जुन ने उन दोनों सेनाओं में खड़े पिता के भाइयों,  पितामहों,  आचार्यों,  मामों, भाइयों, पुत्रों,  पौत्रों,  मित्रों,  श्वसुरों और सुहृदों को भी देखा।","।।1.26।।वहीं अर्जुन ने उन दोनों साक्षियों में निष्ठावान पिता के श्रमिकों, पितामहों, आचार्यों, माताओं, श्रमिकों, पुत्रों, पुत्रों, मित्रों, श्वासुरों और सुहृदों को भी देखा।"
।।1.27।।इस प्रकार उन सब बन्धु-बान्धवों को खड़े देखकर कुन्ती पुत्र अर्जुन का मन करुणा से भर गया और विषादयुक्त होकर उसने यह कहा।,1.27 इस प्रकार उन सब बंधुओं को देखकर कुंती पुत्र अर्जुन का मन करुणा से भर गया और विषादयुक्त बोला।
"।।1.28 1.29।।अर्जुन ने कहा -- हे कृष्ण ! युद्ध की इच्छा रखकर उपस्थित हुए इन स्वजनों को देखकर मेरे अंग शिथिल हुये जाते हैं, मुख भी सूख रहा है और मेरे शरीर में कम्प तथा रोमांच हो रहा है।।","1.28 1.29 अर्जुन ने कहा -- हे कृष्ण ! युद्ध की इच्छा और प्रतिज्ञा करते हुए इन स्वोन्जन को देखकर मेरे अंग में पोर्टेबल रोबोट हैं, मुख भी सुखी है मेरे शरीर में कॉम्प आ रहा है और रोमांच हो रहा है।"
"।।1.28 1.29।।अर्जुन ने कहा -- हे कृष्ण !  युद्ध की इच्छा रखकर उपस्थित हुए इन स्वजनों को देखकर मेरे अंग शिथिल हुये जाते हैं,  मुख भी सूख रहा है और मेरे शरीर में कम्प तथा रोमांच हो रहा है।","1.28 1.29 अर्जुन ने कहा -- हे कृष्ण !  युद्ध की इच्छा और प्रतिज्ञा करते हुए इन स्वोन्जन को देखकर मेरे अंग में पोर्टेबल रोबोट हैं, मेरा भी सुख है मेरे शरीर में कॉम्प आ रहा है और रोमांच हो रहा है।"
"।।1.30।।मेरे हाथ से गाण्डीव (धनुष) गिर रहा है और त्वचा जल रही है। मेरा मन भ्रमित सा हो रहा है,  और मैं खड़े रहने में असमर्थ हूँ।","1.30.मेरे हाथ से गांडीव (धनुष) गिर रहा है और त्वचा जल रही है। मेरा मन असुरक्षित सा हो रहा है, और मैं शेष में असहाय हूं।"
।।1.31।।हे केशव ! मैं शकुनों को भी विपरीत ही देख रहा हूँ और युद्ध में (आहवे) अपने स्वजनों को मारकर कोई कल्याण भी नहीं देखता हूँ।,।।1.31।।हे केशव ! मैं शकों को भी विपरीत ही देख रहा हूं और युद्ध में (अहवे) अपने स्वजनों को कोई कल्याण भी नजर नहीं आ रहा।
"।।1.32।।हे कृष्ण ! मैं न विजय चाहता हूँ, न राज्य और न सुखों को ही चाहता हूँ। हे गोविन्द ! हमें राज्य से अथवा भोगों से और जीने से भी क्या प्रयोजन है?।","।।1.32।।हे कृष्ण ! मैं न विजय चाहता हूँ, न राज्य और न सुख चाहता हूँ। हे !गोविंद हमें राज्य से या वस्तुओं से और जीवन से भी क्या प्रस्ताव है?"
"।।1.33।।हमें जिनके लिये राज्य,  भोग और सुखादि की इच्छा है,  वे ही लोग धन और जीवन की आशा को त्यागकर युद्ध में खड़े हैं।","।।1.33।। हमें अपने स्थान के लिए, भोग और सुखादि की इच्छा है, वे ही लोग धन और जीवन की आशा को त्यागकर युद्ध में विश्वास रखते हैं।"
"।।1.34।।वे लोग गुरुजन,  ताऊ,  चाचा,  पुत्र,  पितामह,   श्वसुर,  पोते,  श्यालक तथा अन्य सम्बन्धी हैं।","।।1.34।।वे लोग गुरुजन, ताऊ, चाचा, पुत्र, पितामह, श्वसुर, पद, श्यालक तथा अन्य संबंध हैं।"
"।।1.35।।हे मधुसूदन !  इनके मुझे मारने पर अथवा त्रैलोक्य के राज्य के लिये भी मैं इनको मारना नहीं चाहता,  फिर पृथ्वी के लिए कहना ही क्या है।","।।1.35।।हे मधुसूदन !  इनमें से मुझे मारने पर या त्रैलोक्य के राज्य के लिए भी मैं भूखा नहीं चाहता, फिर पृथ्वी के लिए कहता हूं ही क्या है।"
।।1.36।।हे जनार्दन ! धृतराष्ट्र के पुत्रों की हत्या करके हमें क्या प्रसन्नता होगी?  इन आततायियों को मारकर तो हमें केवल पाप ही लगेगा।,।।1.36।।हे जनार्दन ! धृतराष्ट्र के पुत्रों की हत्या करके हमें क्या बधाई होगी?  इन अताताइयों को बदनामी तो हमें सिर्फ पाप ही मिलेगा।
"।।1.37।।हे माधव  !  इसलिये अपने बान्धव धृतराष्ट्र के पुत्रों को मारना हमारे लिए योग्य नहीं है,  क्योंकि स्वजनों को मारकर हम कैसे सुखी होंगे।","।।1.37।।हे माधव!  इसलिए आपके बांधव धृतराष्ट्र के पुत्रों को हमारे लिए उपयुक्त नहीं है, क्योंकि स्वजनों को काम पर लगाकर हम कैसे सुखी होंगे।"
।।1.38।।यद्यपि लोभ से भ्रष्टचित्त हुये ये लोग कुलनाशकृत दोष और मित्र द्रोह में पाप नहीं देखते हैं।,।।1.38।।यद्यपि लोभ से पितृचित्त तोते ये लोग कुलनाकृत दोष और मित्र द्रोह में पाप नहीं देखते हैं।
"।।1.39।।परन्तु,  हेे जनार्दन !  कुलक्षय से होने वाले दोष को जानने वाले हम लोगों को इस पाप से विरत होने के लिए क्यों नहीं सोचना चाहिये।","।।1.39।।परन्तु, हे जनार्दन !  कुलक्षय से होने वाले दोष को देखते हुए हम लोगों को इस पाप से विरत होने के लिए क्यों नहीं अलग करना चाहिए।"
।।1.40।।कुल के नष्ट होने से सनातन धर्म नष्ट हो जाते हैं। धर्म नष्ट होने पर सम्पूर्ण कुल को अधर्म (पाप) दबा लेता है।,।।1.40।।कुल के नष्ट होने से सनातन धर्म नष्ट हो जाते हैं। धर्म विनाश होने पर संपूर्ण कुल को अधर्म (पाप) दबाना होता है।
