Original,Translated
"12.7 To those whose minds are set on Me, O Arjuna, verily I become ere long the saviour out of the ocean of Samsara.",..12.7.. Hey Parth! I will soon save those devotees whose mind is fixed on me from the ocean of death.
"12.8 Fix thy mind in Me only, thy intellect in Me, (then) thou shalt no doubt live in Me alone hereafter.","12.8. You fix your mind and intellect in me, only then you will reside in me, there is no doubt in this."
"12.9 If thou art unable to fix thy mind steadily on Me, then by the Yoga of constant practice do thou seek to reach Me, O Arjuna.","..12.9.. Hey Dhananjay! If you are not able to fix your mind on Me, then you should desire (ie try) to attain Me through Abhyasa Yoga."
"12.10 If thou art unable to practise even this Abhyasa Yoga, be thou intent on doing actions for My sake; even by doing actions for My sake, thou shalt attain perfection.","..12.10.. If you are unable even to practice, then become devoted to matkarma; In this way, even while performing deeds for me, you will achieve success."
"12.11 If thou art unable to do even this, then, resorting to union with Me, renounce the fruits of all actions with the self controlled.","..12.11.. And if you are unable to do even this, then by having self-control and taking refuge in Yoga in the form of my attainment, you should give up the fruits of all your actions."
12.12 Better indeed is knowledge than practice; than knowledge meditation is better; than meditation the renunciation of the fruits of actions: peace immediately follows renunciation.,..12.12.. Knowledge is better than practice; Meditation is better than knowledge and the fruit of action better than meditation is renunciation; One gets immediate peace.
"12.13 He who hates no creature, who is friendly and compassionate to all, who is free from attachment and egoism, balanced in pleasure and pain, and forgiving.","..12.13.. Who is without malice towards all living beings and is a friend and compassionate person to all; Who is free from attachment and ego, equanimous and forgiving in happiness and sorrow."
"12.14 Ever content, steady in meditation, self-controlled, possessed of firm conviction, with the mind and intellect dedicated to Me, he, My devtoee, is dear to Me.","..12.14.. The balanced soul, the determined yogi who is always content, the one who has surrendered his mind and intellect to me, the one who is such a devotee of mine, he is dear to me."
"12.15 He by whom the world is not agitated and who cannot be agitated by the world, and who is freed from joy, anger, fear and anxiety  he is dear to Me.","..12.15.. The devotee from whom no world (i.e. living being, person) gets agitated and who himself does not experience agitation from any person and who is free from joy, amarsh (intolerance), fear and excitement, is dear to me."
"12.16 He who is free from wants, pure, expert, unconcerned, and free from pain, renouncing all undertakings or commencements  he who is (thus) devoted to Me, is dear to Me.","..12.16.. The one who is my devotee who has no expectations, is pure, efficient, disinterested, free from pain and has renounced all activities, is dear to me."
"12.17 He who neither rejoices, nor hates, nor grieves, nor desires, renouncing good and evil, and who is full of devotion, is dear to Me.","..12.17.. One who neither rejoices nor hates; Neither mourns nor longs; And the one who gives up auspicious and inauspicious, that devout man is dear to me."
Swami Sivananda did not comment on this sloka,Swami Tejomayananda did not comment on this sloka
"12.19 He to whom censure and praise are eal, who is silent, content with anything, homeless, of a steady mind, and full of devotion  that man is dear to Me.","..12.19.. The one who is equal to both praise and criticism, who is silent, who is satisfied with even a small thing, who is indecisive, that devoted man with a stable mind is dear to me."
"12.20 They verily who follow this immortal Dharma (law or doctrine) as described above, endowed with faith, regarding Me as their supreme goal, they, the devotees, are exceedingly dear to Me.","..12.20.. Those devotees who are devout and consider me as the ultimate goal and follow this righteous nectar i.e. a righteous life, they are very dear to me."
"13.1 Arjuna said  I wish to learn about Nature (matter) and the Spirit (soul), the field and the knower of the field, knowledge and that which ought to be known, O Kesava.","..13.1.. Arjun said--O Keshav! I want to know nature and man, area and the subject, knowledge and the known."
"13.2 The Blessed Lord said  This body, O Arjuna, is called the field; he who knows it is called the knower of the field, by those who know of them.","13.2. Shri Bhagwan said - O Kaunteya! This body is called Kshetra and the one who knows it is called Tatvagya Jan, Kshetragya."
"13.3 Do thou also know Me as the knower of the field in all fields, O Arjuna. Knowledge of both the field and the knower of the field is considered by Me to be ï1the ï1 knowledge.",13.3. Hey India! You know me only as an expert in all fields. It is my opinion that the knowledge of the field and the expert is the real knowledge.
"13.4 What the field is and of what nature, what are its modifications and whence it is and also who He is and what His powers are  hear all that from Me in brief.","13.4. Therefore, hear from me in brief what that field is and what it is like and the disorders it has, and the (reason) due to which the (action) has happened and also what it (Kshetragya) is and what effect it has."
"13.5 Sages have sung in many ways, in various distinctive chants and also in the suggestive words indicative of the Absolute, full of reasoning and decisive.","13.5. (Concerning the Kshetra-Kshetrajna) has been sung in many ways by the sages in various and sundry verses, and has also been (said in the same way) through the verses of the Brahma Sutra properly determined and justified (i.e. through the words indicative of Brahma). .."
"13.6 The great elements, egoism, intellect, and also the Unmanifested Nature, the ten senses and one (mind), and the five objects of the senses.","13.6. Panch Mahabhuta, ego, intellect, unmanifested (nature), ten senses, one mind, five objects of senses."
"13.7 Desire, hatred, pleasure, pain, the aggregate (the body), intelligence, fortitude  the field has thus been briefly described with its modifications.","..13.7.. Desire, aversion, happiness, sorrow, Sanghat (physical body), Chetna (conscious instinct of the conscience) and Dhriti - thus this area is stated in brief along with the disorders."
"13.8 Humility, unpretentiousness, non-injury, forgiveness, uprightness, service of the teacher, purity, steadfastness, self-control.","..13.8.. Inhumanity, humility, non-violence, forgiveness, arjava, service to Acharya, purification, stability and self-control."
"13.9 Indifference to the objects of the senses and also absence of egoism; perception of (or reflection on) the evil in birth, death, old age, sickness and pain.","..13.9.. Detachment towards the objects of the senses, absence of ego, seeing faults in birth, death, old age, disease and sorrow..."
"13.10 Non-attachment, non-identification of the Self with son, wife, home and the rest, and constant even-mindedness on the attainment of the desirable and the undesirable.","..13.10.. Attachment and lack of identification with son, wife, home etc.; And equanimity in achieving good and evil."
"13.11 Unswerving devotion unto Me by the Yoga of non-separation, resort to solitary places, distaste for the society of men.",..13.11.. Unadulterated devotion in Me through Ananyayoga; Nature of living in a solitary place and disinterest in the community of (uncultured) people.
"13.12 Constancy in Self-knowledge, perception of the end of true knowledge  this is declared to be knowledge, and what is opposed to it is ignorance.","..13.12.. In spiritual knowledge, eternity i.e. stability and the philosophy of God as the meaning of philosophy, all this is called knowledge, and whatever is contrary to this is ignorance."
"13.13 I will declare that which has to be known, knowing which one attains to immortality, the beginningless supreme Brahman, called neither being nor non-being.","..13.13.. I will clearly describe that knowable object by knowing which man attains immortality. He is knowable - the eternal, ultimate Brahma, who can be called neither true nor false."
"13.14 With hands and feet everywhere, with eyes, heads and mouths everywhere, with ears everywhere, He exists in the worlds enveloping all.","..13.14.. He has arms and legs on all sides, eyes, head and mouth on all sides and ears on all sides; He is situated pervading everyone in the world."
"13.15 Shining by the functions of all the senses, yet without the senses; unattached, yet supporting all; devoid of alities, yet their experiencer.","..13.15.. He is illuminated by the qualities (functions) of all the senses, but is (actually) devoid of all the senses; Despite being free from attachment and devoid of virtues, He is the sustainer of all and the enjoyer of virtues."
"13.16 Without and within (all) beings the unmoving and also the moving; because of Its subtlety, unknowable; and near and far away is That.",..13.16.. (That Brahma) is situated within the existence of mere existence; He is variable and also constant. Being subtle it is undetectable; He is both distant and very close.
"13.17 And undivided, yet It exists as if divided in beings; It is to be known as the supporter of being; It devours and It generates.","..13.17.. And He is undivided, yet He is situated among the ghosts like a divided one. That knowable Brahma is the creator, destroyer and originator of all existence."
"13.18 That, the Light of all lights, is said to be beyond darkness: knowledge, the knowable and the goal of knowledge, seated in the hearts of all.",..13.18.. (That Brahma) is said to be the light of lights and beyond the darkness of (ignorance). That knowledge (Chaitanya Swarup) is knowable and knowable through knowledge (Gyangamya). He is situated in everyone's heart.
"13.19 Thus the field, as well as knowledge and the knowable have been briefly stated. My devotee, knowing this, enters into My Being.","..13.19.. Thus, (by me) the field, knowledge and the known were briefly stated. By knowing it from its essence (Vigyaya), My devotee attains My form."
13.20 Know thou that Nature (matter) and the Spirit are both beginningless; and know also that all modifications and alities are born of Nature.,..13.20.. You should know both nature and man as eternal. And you should also know that all the vices and virtues have arisen from nature itself.
"13.21 In the production of the effect and the cause, Nature (matter) is said to be the cause; in the experience of pleasure and pain, the soul is said to be the cause.",..13.21.. Prakriti is said to be the cause in giving rise to cause and effect and Purusha is said to be the cause in the enjoyment of happiness and sorrow.
13.22 The soul seated in Nature experiences the alities born of Nature; attachment to the alities is the cause of its birth in good and evil wombs.,..13.22.. A man situated in nature enjoys the qualities emanating from nature. The combination of these qualities is the reason for this man (being) to be born in auspicious and inauspicious species.
"13.23 The Supreme Soul in this body is also called the spectator, the permitter, the supporter, the enjoyer, the great Lord and the Supreme Self.","..13.23.. The Supreme Being is called the Creator, Sumanta, Bharta, Enjoyer, Maheshwar and Supreme Soul in this body."
"13.24 He who thus knows the Spirit and Matter together with the alities, in whatever condition he may be, he is not born again.","..13.24.. In this way, the man who knows nature along with man and qualities, even while living (behaving) in every way, is not born again."
"13.25 Some by meditation behold the Self in the self by the self, others by the Yoga of knowledge, and still others by the Yoga of action.","..13.25.. Some men, by the practice of meditation, see the soul in the soul (heart) through the soul (pure intellect); Others see the soul through Sankhya Yoga and some seekers through Karma Yoga."
"13.26 Others also, not knowing thus, worship, having heard of It from others; they, too, cross beyond death, regarding what they have heard as the Supreme refuge.","..13.26.. But, other people who worship only after hearing from others (Acharyas) without knowing it themselves, those people who are Shrutiparayan (i.e. for whom hearing is the ultimate means) also avoid death without any doubt."
"13.27 Wherever a being is born, whether unmoving or moving, know thou, O best of the Bharatas (Arjuna), that it is from the union between the field and its knower.","..13.27.. O great Bharat! In other words, whatever immovable or movable object is produced, you should know that it has arisen from the combination of the field and the knower of the field."
"13.28 He sees, who sees the Supreme Lord, existing eally in all beings, the unperishing within the perishing.","..13.28.. The man who sees the immortal God present in all mortal beings with equanimity, only he (really) sees."
13.29 Because he who sees the same Lord eally dwelling everywhere does not destroy the Self by the self; he goes to the highest goal.,"..13.29.. Certainly, that man does not destroy the soul (swayam) through the soul (swayam) who is equal to God and is present everywhere with equal feelings, through this he attains the supreme state."
"13.30 He sees, who sees that all actions are performed by Nature alone and that the Self is actionless.","..13.30.. The man who sees all the actions as being done entirely by nature and sees the soul as the non-doer, only he (truly) sees."
"13.31 When a man sees the whole variety of beings as resting in the One, and spreading forth from That alone, he then becomes Brahman.","..13.31.. When this man sees the separate expressions of the ghosts situated in one (God) and knows that this expansion has come from Him (God) only, then he attains Brahma."
"13.32 Being without beginning and being devoid of (any) alities, the Supreme Self, imperishable, though dwelling in the body, O Arjuna, neither acts nor is tainted.","..13.32.. Hey Konteya! Being eternal and without qualities, this God is indestructible. Although situated in the body, in reality, he neither performs (actions) nor gets attached (to the fruits)."
"13.33 As the all-pervading ether is not tainted, because of its subtlety, so the Self seated everywhere in the body is not tainted.","..13.33.. Just as the omnipresent sky does not get entangled because it is subtle, in the same way the soul present in the body does not get entangled everywhere."
"13.34 Just as the one sun illumines the whole world, so also the Lord of the field (Supreme Self) 
illumines the whole field, O Arjuna.","..13.34.. Hey India! Just as only one sun illuminates the entire world, in the same way only one Kshetri (expert in the field) illuminates the entire region."
"13.35 They who, by the eye of knowledge, perceive the distinction between the field and its knower and also the liberation from the Nature of being, go to the Supreme.","..13.35.. Thus, those men who, through the eye of knowledge, know the difference between the field and the knower of the field and salvation from the disorders of nature, they attain the Supreme Brahma."
"14.1 The Blessed Lord said  I will again declare (to thee) that supreme knowledge, the best of all knowledge, having known which all the sages have gone to the supreme perfection after this life.","..14.1.. Shri Bhagwan said - I will again tell you about the supreme knowledge, which is the best among all the knowledge, knowing which all the sages have attained the ultimate success after leaving this world."
"14.2 They who, having taken refuge in this knowledge, have attained to unity with Me, are neither born at the time of creation nor are they disturbed at the time of dissolution.","14.2. By taking refuge in this knowledge, the people who attain my form (Sardhamyam) do not take birth in the beginning of creation and do not get troubled in the time of destruction."
"14.3 My womb is the great Brahma; in that I place the germ; thence, O Arjuna, is the birth of all beings.",14.3. Hey India! My Mahad Brahmarup Prakriti is the vagina (of the ghosts) in which I conceive; From this all ghosts are born.
"14.4 Whatever forms are produced, O Arjuna, in any womb whatsoever, the great Brahma is their womb and I am the seed-giving father.","..14.4.. Hey Konteya! All the idols (bodies) that are born in all the births, the birth i.e. the womb of all of them is Mahadbrahma and I am the father who establishes the seed."
"14.5 Purity, passion and inertia  these alities, O Arjuna, born of Nature, bind fast in the body, the embodied, the indestructible.","..14.5.. Oh great arms! Sattva, Raja and Tama, these three qualities arising from nature bind the physical soul with the body."
"14.6 Of these, Sattva, which from its stainlessness is luminous and healthy, binds by attachment to happiness and by attachment to knowledge, O sinless one.","..14.6.. O sinless Arjun! Of these (three), Sattva Guna, being pure, is luminous and anamaya (free from matter, free from disorders); (He binds the living being) with attachment to happiness and attachment to knowledge."
"14.7 Know thou Rajas to be of the nature of passion, the source of thirst (for sensual enjoyment) and attachment; it binds fast, O Arjuna, the embodied one by attachment to action.","14.7. Hey Konteya! Know Rajoguna as the form of Raga, which gives rise to craving and attachment. He binds the physical soul with the attachment of deeds."
"14.8 But know thou Tamas to be born of ignorance, deluding all embodied beings; it binds fast, O Arjuna, by heedlessness, indolence and sleep.","..14.8.. And oh India! Know that Tamoguna arises from ignorance; Which fascinates all the living beings. He binds the living being through carelessness, laziness and sleep."
"14.9 Sattva attaches to happiness, Rajas to action, O Arjuna, while Tamas verily shrouding knowledge attaches to heedlessness.","..14.9.. Hey India! Sattva guna makes one engrossed in happiness and Rajo guna in action, but Tamo guna covers the knowledge and makes the living being in a state of heedlessness."
"14.10 Now Sattva arises (prevails), O Arjuna, having overpowered Rajas and Tamas; nor Rajas, having overpowered Sattva and Tamas; and now Tamas, having overpowered Sattva and Rajas.","..14.10.. Hey India! Sometimes Sattva Guna increases by suppressing Rajas and Tama, sometimes Tama Guna increases by suppressing Rajas and Satva, and sometimes Rajo Guna increases by suppressing Tama and Satva."
"14.11 When through every gate (sense) in this body, the wisdom-light shines, then it may be known that Sattva is predominant.","..14.11.. When light in the form of knowledge arises in the doors of this body i.e. in all the senses, then know that Sattva Guna has increased."
"14.12 Greed, activity, the undertaking of actions, restlessness, longing  these arise when Rajas is predominant, O Arjuna.","..14.12.. O great Bharata! When Rajogun increases, greed, tendency (common intention), initiation of actions, lack of shame and desire, all these arise."
"14.13 Darkness, inertness, heedlessness and delusion  these arise when Tamas is predominant, O Arjuna.","..14.13.. Hey Kurunandan! When Tamoguna increases, darkness, indifference, carelessness and attachment all arise."
"14.14 If the embodied one meets with death when Sattva is predominant, then he attains to the spotless worlds of the knowers of the Highest.","..14.14.. When this living being (Dehbhrit) dies in the growth of Sattva Guna, then those who do good deeds attain the pure worlds i.e. heaven."
"14.15 Meeting death in Rajas, he is born among those who are attached to action; and dying in Tamas, he is born in the womb of the senseless.","..14.15.. After dying during the progression of Rajoguna, he takes birth in the human world and during the progression of Tamoguna (after death), he takes birth in the world of foolishness."
"14.16 The fruit of good action, they say, is Sattvic and pure, verily the fruit of Rajas is pain, and ignorance is the fruit of Tamas.",..14.16.. The results of good deeds have been said to be pure and pure; The result of Rajogun is sorrow and the result of Tamogun is ignorance.
"14.17 From Sattva arises knowledge, and greed from Rajas; heedlessness and delusion arise from Tamas, and also ignorance.","..14.17.. Knowledge arises from Sattva Guna. Rajogun gives rise to greed and Tamagogun gives rise to carelessness, attachment and ignorance."
"14.18 Those who are seated in Sattva go upwards; the Rajasic dwell in the middle; and the Tamasic, abiding in the function of the lowest Guna, go downwards.",..14.18.. Men situated in Sattva Guna go higher (to the worlds); Rajasic people live in the middle (human world) and Tamasic people living in extremely inferior tendencies of Tamogun attain degradation.
"14.19 When the seer beholds no agent other than the Gunas and knows That which is higher than they, he attains to My Being.","..14.19.. When the seer (seeker) does not see anyone other than the three Gunas as the doer, i.e. does not understand and knows My essence beyond the three Gunas, then he attains My form."
"14.20 The embodied one having crossed beyond these three Gunas out of which the body is evolved, is freed from birth, death, decay and pain, and attains to immortality.","..14.20.. This physical man, having gone beyond the three gunas due to the origin of the body, attains immortality and is freed from birth, death, aging and sorrows."
"14.21 Arjuna said  What are the marks of him who has transcended the three alities, O Lord? What is his conduct and how does he go beyond these three alities?","..14.21.. Arjun said - Oh Lord! What characteristics does a man who has gone beyond these three qualities possess? What kind of behavior does he have? And, by what means does he go beyond these three qualities?"
"14.22 The Blessed Lord said  When light, activity and delusion are present, he hates them not, nor does he long for them when they are absent.","..14.22.. Shri Bhagwan said – O Pandava! (The wise man) does not hate light, inclination and attachment even when he is affected by them and does not yearn for them when he retires."
"14.23 He who, seated like one unconcerned, is not moved by the alities, and who, knowing that the alities are active, is self-centred and moves not.",..14.23.. One who remains seated like an indifferent person cannot be disturbed by the qualities and remains stable knowing that “the qualities only behave” and does not get distracted from that position.
"14.24 Who is the same in pleasure and pain, who dwells in the Self, to whom a clod of earth, stone and gold are alike, who is the same to the dear and the unfriendly, who is firm, and to whom censure and praise are as one.","..14.24.. One who is healthy (situated in form), remains equal in happiness and sorrow and has equanimity among soil, stone and gold; Such a brave man considers what is liked and what is unpleasant and criticism and self-praise as equal."
"14.25 Who is the same in honour and dishonour, the same to friend and foe, abandoning all undertakings  he is said to have transcended the alities.","..14.25.. Who is equal in honor and dishonor; There is equality in favor of enemy and friend, such a man who forsakes everything from the beginning is said to be Gunateet."
"14.26 And he who serves Me with unswerving devotion, he, crossing beyond the alities, is fit for becoming Brahman.","..14.26.. The man who serves me through unadulterated bhaktiyoga, transcends these three qualities and becomes eligible to become Brahma."
"14.27 For I am the abode of Brahman, the immortal and the immutable, of everlasting Dharma and of absolute bliss.","..14.27.. Because I am the establishment of immortality, immortality, Brahma, eternal religion and exclusive i.e. transcendental happiness."
"15.1 The Blessed Lord said  They (the wise) speak of the indestructible peepul tree having its root above and branches below, whose leaves are the metres or hymns: he who knows it is a knower of the Vedas.","..15.1.. Shri Bhagwan said - (The wise man calls this worldly tree) Ashvattha and Avya having vertical root and half branch; The one who knows such (worldly tree) whose leaves are verses i.e. Vedas, is a Vedavit."
"15.2 Below and above spread its branches, nourished by the Gunas; sense-objects are its buds; and below, in the world of men, stretch forth the roots, originating action.","..15.2.. The branches of that tree, filled with qualities, spread below and above; (Panch) subjects are its shoots; Its other roots, which follow the actions in the human world, are spread below."
"15.3 Its form is not perceived here as such, neither its end nor its origin, nor its foundation nor resting place: having cut asunder this firmly rooted peepul tree with the strong axe of non-attachment.","15.3. The form of this (world tree) as stated is not available here, because it has neither beginning nor end nor prestige. By cutting this very strong rooted Ashvattha tree with the strong Asanga weapon..."
"15.4 Then That goal should be sought for, whither having gone none returns again. I seek refuge in that Primeval Purusha Whence streamed forth the ancient activity or energy.","..15.4.. (After that) one should search for that position which the men having attained do not return to the world again. ""I take refuge in that original man from whom this ancient trend has spread."""
