Original,Translated
"8.12 Having closed all the gates, confined the mind in the heart and fixed the life-breath in the head, engaged in the practice of concentration.","8.12. By controlling all the doors (of the senses), stabilizing the mind in the heart and establishing the life force in the head, he became established in Yogadharana."
"8.13 Uttering the one-syllabled Om  the Brahman  and remembering Me, he who departs, leaving the body, attains to the Supreme Goal.","8.13. The person who leaves his body while reciting this one syllable 'Om', Brahma and remembering me, attains the supreme state."
"8.14 I am easily attainable by that ever-steadfast Yogi who constantly and daily remembers Me (for a long time), not thinking of anything else (with a single mind or one-pointed mind), O Partha (Arjuna).","..8.14.. Hey Parth! I am easily accessible to the daily yogi who remembers me with a single mind, that is, I am easily attained."
"8.15 Having attained Me these great souls do not again take birth (here) which is the place of pain 
and is non-eternal: they have reached the highest perfection (liberation).","..8.15.. The great souls who have attained supreme success, after attaining me, do not get rebirth in the homely form of eternal sorrow."
"8.16 (All) the worlds including the world of Brahma are subject to return again, O Arjuna; but he who reaches Me, O son of Kunti, has no rirth.","..8.16.. Hey Arjun! Everyone up to Brahma Loka is of reclusive nature. But, O Kaunteya! There is no rebirth after attaining me."
"8.17 Those people who know the day of Brahma which is of a duration of a thousand Yugas (ages) and the night which is also of a thousand Yugas duration, they know day and night.","..8.17.. Those who know the duration of one day of Lord Brahma which is of a thousand years and know the duration of a night of one thousand years, they are the men who know the day and night."
8.18 From the Unmanifested all the manifested (worlds) proceed at the coming of the 'day'; at the coming of the 'night' they dissolve verily into ï1thatï1 alone which is called the Unmanifested.,"..8.18.. When (Brahmaji's) day rises, from the unexpressed (this) manifest (charachar world) arises; And on the arrival of (Brahmaji's) night, he gets absorbed in the same unmanifested."
"8.19 This same multitude of beings, being born again and again, is dissolved, helplessly, O Arjuna (into the Unmanifested) at the coming of the night and comes forth at the coming of the day.","..8.19.. Hey Parth! It is this ghost community, which is born again and again and gets absorbed. Avash Hua (this ghost village) disappears with the arrival of night and manifests with the rise of day."
"8.20 But verily there exists, higher than this Unmanifested, another unmanifested Eternal, which is not destroyed when all beings are destroyed.","..8.20.. But beyond that unmanifested thing, the other eternal unmanifested feeling does not get destroyed even after the destruction of all the ghosts."
"8.21 What is called the Unmanifested and the Imperishable, That they say is the highest goal. They who reach It do not return (to this Samsara). That is My highest abode (place or state).","..8.21.. The latent letter which has been said is the ultimate goal (goal). The one which (the devotees) do not return back (to the world) after attaining it, is my supreme abode."
"8.22 That highest Purusha, O Arjuna, is attainable by unswerving devotion to Him alone within Whom all beings dwell and by Whom all this is pervaded.","8.22. Hey Parth! The Supreme Being, under whom all the beings are included and through whom this entire world is pervaded, is attainable only through exclusive devotion."
"8.23 Now I will tell thee, O chief of Bharatas, the times departing at which the Yogis will return or not return.",..8.23.. O Bharatashrestha! I will tell you the period (path) during which the yogis who have left their bodies attain non-repetition and (or) re-occurrence.
"8.24 Fire, light daytime, the bright fortnight, the six months of the northern path of the sun (the northern solstice)  departing then (by these) men who know Brahman go to Brahman.","..8.24.. Those Brahmavid devotees who go through the path of six months of Agni, Jyoti, Din, Shuklapaksha and Uttarayan after death, attain Brahma."
"8.25 Attaining to the lunar light by smoke, night time, the dark fortnight also, the six months of the southern path of the sun (the southern solstice), the Yogi returns.","..8.25.. The Yogi returns (to the world) after attaining the light of the moon through the six-monthly path of Dhoom, Night, Krishna Paksha and Dakshinayan."
8.26 The bright and the dark paths of the world are verily thought to be eternal; by the one (the bright path) a man goes not to return and by the other (the dark path) he returns.,"8.26. These two types of Shukla and Krishna paths of the world are considered eternal. Of these, through one (Shukla) (the seeker) one achieves non-repetition and through the other (Krishna) one achieves repetition."
"8.27 Knowing these paths, O Arjuna, no Yogi is deluded; therefore at all times be steadfast in Yoga.","..8.27.. O Partha, no yogi who knows these two paths (from the elements) becomes bewildered. Therefore, O Arjuna! May you all become yogyukt in time."
"8.28 Whatever fruit of merit is declared (in the scriptures) to accrue from (the study of) the Vedas, (the performance of) sacrifices, (the practice of) austerities, and gifts  beyond all this goes the Yogi, having known this; and he attains to the Supreme Primeval (first or ancient) Abode.","..8.28.. Knowing all this (the essence of both the paths), a yogi person violates all the virtuous results mentioned in the study of Vedas, yagya, penance and charity and attains the original (eternal), supreme place."
"9.1 The Blessed Lord said  I shall now declare to thee who does not cavil, the greatest secret, the knowledge combined with experience (Self-realisation). Having known this thou shalt be free evil.","9.1. Shri Bhagwan said - For you Anasuyu (without flawed vision), I will tell you this secret knowledge along with science, knowing which you will be free from inauspicious (worldly bondage)."
"9.2 This is the kingl science, the kingly secret, the supreme purifier, realisable by direct intuitional knowledge, according to righteousness, very easy to perform and imperishable.","9.2. This knowledge is Rajvidya (king of knowledge) and Rajguhya (king of all secrets i.e. secrets) and is sacred, good, having direct knowledge and religious, and is easy and indispensable in doing."
"9.3 Those who have no faith in this Dharma (knowledge of the Self), O Parantapa (Arjuna), return to the path of this world of death without attaining Me.","9.3. Hey Parantap! In this religion, people without faith do not attain me but live (travel) in the world of death."
"9.4 All this world is pervaded by Me in My unmanifest aspect; all beings exist in Me, but I do not dwell in them.","9.4. This entire universe is pervaded by the unmanifested form of Me (God); The ghosts are present in me, but I am not present in them."
"9.5 Nor do beings exist in Me (in reality); behold My divine Yoga, supporting all beings, but not dwelling in them, is My Self, the efficient cause of beings.",9.5. And (in reality) the mere existence is not situated in me; Look at my divine yoga that my soul which holds the ghosts and which creates the ghosts is not present in those ghosts.
"9.6 As the mighty wind, moving everywhere, rests always in the ether, even so, know thou that all beings rest in Me.","9.6. Just as the great wind that travels everywhere is always present in the sky, similarly all the ghosts are present in me, know this."
"9.7 All beings, O Arjuna, go into My Nature at the end of a Kalpa; I send them forth again at the beginning of (the next) Kalpa.","9.7. Hey Konteya! (1) At the end of the Kalpa, all the ghosts attain my nature; And I create them again at the beginning of the (second) Kalpa."
"9.8 Animating My Nature, I again and again send forth all this multitude of beings, helpless by the force of the Nature.","9.8. By bringing nature under my control (i.e. by giving it consciousness), I again and again create this entire ghost community which has become dependent under the influence of nature."
"9.9 These acts do not bind Me, O Arjuna, sitting like one indifferent, unattached to those acts.","..9.9.. Hey Dhananjay! Those actions do not bind me (God), who is free from attachment and indifferent to those actions."
"9.10 Under Me as supervisor, Nature produces the moving and the unmoving; because of this, O Arjuna, the world revolves.",..9.10.. Hey Konteya! Because of me as the president (i.e. under my leadership) nature gives birth to the living world; This is why this world keeps rotating.
"9.11 Fools disregard Me, clad in human form, not knowing My higher Being as the great Lord of (all) beings.","9.11. Not knowing the ultimate meaning of Me, the great God of all beings, foolish people disrespect Me, the Supreme Soul, in human form."
"9.12 Of vain hopes, of vain actions, of vain knowledge and senseless, they verily are possessed of the deceitful nature of demons and undivine beings.","9.12. Ignorant people with useless hopes, useless actions and useless knowledge retain the bewitching nature of demons and demons."
"9.13 But the great souls, O Arjuna, partaking of My divine nature, worship Me with a single mind (with the mind devoted to nothing else), knowing Me as the imperishable source of beings.","..9.13.. Hey Parth! But great men dependent on the divine nature, considering me to be the original cause and eternal form of all existences, worship me with a single mind."
"9.14 Always glorifying Me, striving,firm in vows, prostrating themselves before Me, they worship Me with devotion always steadfast.","..9.14.. Constantly chanting My Kirtan, hard-working, steadfast men, saluting Me, worshiping Me with daily devotion."
"9.15 Others also sacrificing with the wisdom-sacrifice worship Me, the All-faced, as one, as distinct, and as manifold.","9.15. Some worship me with a sense of unity while worshiping me through the Gyan Yagya, some worship me with a separate feeling, some worship me as a vast form (Vishwato Mukham) in many ways."
9.16 I am the Kratu; I am the Yajna; I am the offering (food) to the manes; I am the medicinal herbs and all the plants; I am the Mantra; I am also the Ghee or the melted butter; I am the fire; I am the oblation.,"..9.16.. I am Rikratu; I am Yagya; I am Swadha and medicine, I am Mantra, I am Ghee, I am Fire and I am Hutan i.e. Havan Karma."
"9.17 I am the father of this world, the mother, the dispenser of the fruits of actions and the 
grandfather; the (one) thing to be known, the purifier, the sacred monosyllable (Om), and also the Rik-, the Sama-and the Yajur-Vedas.","9.17. I am the father, mother, dhata (bearer) and grandfather of this world, I am the Vedya (thing worth knowing), I am the sacred, Omkar, Rigveda, Samveda and Yajurveda."
"9.18 I am the goal, the supporter, the Lord, the witness, the abode, the shelter, the friend, the origin, the dissolution, the foundation, the treasure-house and the seed which is imperishable.","..9.18.. I am the speed (goal), the sustainer, the Lord (master), the witness, the abode, the refuge and friend and also the origin, the form of destruction and the place (base), the foundation and the eternal cause."
"9.19 (As the sun) I give heat; I withhold and send forth the rain; I am immortality and also death, existence and non-existence, O Arjuna.",..9.19.. Hey Arjun! I alone (in the form of the Sun) get hot; I control and emit rain. I am nectar and death and true and false.
"9.20 The knowers of the three Vedas, the drinkers of Soma, purified of all sins, worshipping Me by sacrifices, pray for the way to heaven; they reach the holy world of the Lord of the gods and enjoy in heavn the divine pleasures of the gods.","..9.20.. Those who know the three Vedas (those who perform fruitful actions based on Vedas), those who drink soma and those who are purified from sins, want to attain heaven by worshiping me through yagyas; Those men attain Indraloka as a result of their good deeds and enjoy the pleasures of the divine gods in heaven."
"9.21 They, having enjoyed the vast heaven, enter the world of mortals when their merit is exhausted; thus abiding by the injunctions of the ï1threeï1 (Vedas) and desiring (objects of) desires, they attain to the state of going and returning.","..9.21.. After enjoying that vast heaven, when their virtues wane, they reach the world of death. In this way, the people who take refuge in the work as stated in the three Vedas and desire the pleasures, attain the state of transportation (Gatagata)."
"9.22 For those men who worship Me alone, thinking of no other, for those ever-united, I secure what is not already possessed and preserve what they already possess.",..9.22.. I take care of the welfare of those devotees who worship me by thinking of me with utmost devotion.
"9.23 Even those devotees who, endowed with faith, worship other gods, worship Me alone, O Arjuna, b the wrong method.","..9.23.. Hey Konteya! The devotees with faith who worship other gods, also worship me unrighteously."
"9.24 (For) I alone am the enjoyer and also the Lord of all sacrifices; but they do not know Me in essence (in reality), and hence they fall (return to this mortal world).","..9.24.. Because I am the enjoyer and master of all yagyas, but they do not know Me in essence, that is why they fall, that is, they attain the world."
9.25 The worshippers of the gods go to them; to the manes go the ancestor-worshippers; to the deities who preside over the elements go their worshippers; but My devotees come to Me.,"..9.25.. The worshipers of the Gods go to the Gods, the worshipers of the ancestors go to the ancestors, the worshipers of the ghosts go to the ghosts and the devotees who worship me go to me only."
"9.26 Whoever offers Me with devotion a leaf, a flower, a fruit or a little water  that, so offered devotedly by the pure-minded, I accept.","..9.26.. Any devotee who offers leaves, flowers, fruits, water etc. for me with devotion, I enjoy that devotionally offered (Patra Pushpadi) of that pure minded devotee, that is, I accept it."
"9.27 Whatever thou doest, whatever thou eatest, whatever thou offerest in sacrifice, whatever thou givest, whatever thou practisest as austerity, O Arjuna, do it as an offering unto Me.","..9.27.. Hey Konteya! Whatever work you do, whatever you eat, whatever havan you perform, whatever you donate and whatever penance you perform, you should offer it all to me."
"9.28 Thus shalt thou be freed from the bonds of actions yielding good and evil fruits; with the mind steadfast in the Yoga of renunciation, and liberated, thou shalt come unto Me.","..9.28.. In this way you will be freed from the bondages of karma as a result of good and bad luck; And if you become wise through Sannyasa Yoga, you will become free and reach me."
9.29 The same am I to all beings; to Me there is none hateful or dear; but those who worship Me with devotion are in Me and I am also in them.,..9.29.. I am equal to all beings; Neither is anyone unpleasant nor dear to me; But those who worship me with devotion are in me and I am also in them.
"9.30 Even if the most sinful worships Me, with devotion to none else, he too should indeed by regarded as righteous for he has rightly resolved.","..9.30.. If even a very evil person becomes my devotee and worships me with full dedication, he deserves to be considered a saint because he has true faith."
"9.31 Soon he becomes righteous and attains to eternal peace; O Arjuna, proclaim thou for certain that My devotee never perishes.","..9.31.. O Kaunteya, he soon becomes a virtuous soul and attains eternal peace. You must know the truth that my devotee never gets destroyed."
"9.32 For, taking refuge in Me, they also who, O Arjuna, may be of a sinful birth  women, Vaisyas as well as Sudras  attain the Supreme Goal.","..9.32.. Hey Parth! Women, Vaishyas and Shudras, whosoever are sinful, they also attain the supreme state by depending on me (surrendering to me)."
"9.33 How much more (easily) then the hold Brahmins and devoted royal saints (attain the goal); having come to this impermanent and unhappy world, do thou worship Me.","..9.33.. Then what is there to say that virtuous Brahmins and Rajarshi devotees (achieve the supreme state); (Therefore) after attaining this impermanent and pleasureless world, (now) you worship me with devotion."
"9.34 Fix thy mind on Me; by devoted to Me; sacrifice unto Me; bow down to Me; having thus united thy whole self to Me, taking Me as the supreme goal, thou shalt come unto Me.","..9.34.. (You) be of steadfast mind in Me; Become my devotee and my worshipper; Greet me; In this way, by becoming self-oriented (i.e., whose ultimate goal is I), by uniting your soul with me, you will attain me."
"10.1 The Blessed Lord said  Again, O mighty-armed Arjuna, listen to my supreme word which I will declare to thee who who art beloved, for thy welfare.","10.1. Shri Bhagwan said – O mighty-armed one! Again, listen to my supreme words, which I will say with a desire to benefit the one who loves you very much."
10.2 Neither the hosts of the gods nor the great sages know My origin; for in every way I am the source of all the gods and the great sages.,10.2. Neither the gods nor the great sages know my origin (Prabhav); Because I am the original cause of all the gods and Maharishis also.
"10.3 He who knows Me as unborn and beginningless, as the great Lord of the worlds, he, among mortals, is undeluded and he is liberated from all sins.","10.3. One who knows Me as the unborn, the eternal and the great Lord of the worlds, such a person free from attachment (knowledgeable) among mortal beings becomes free from all sins."
"10.4 Intellect, wisdom, non-delusion, forgiveness, truth, self-restraint, calmness, happiness, pain, existence or birth, non-existence or death, fear and also fearlessness.","10.4. Wisdom, knowledge, absence of attachment, forgiveness, truth, dam (sense control), sham (mind control), happiness, sorrow, birth and death, fear and fearlessness."
"10.5 Non-injury, eanimity, contentment, austerity, beneficence, fame, ill-fame  (these) different kinds of alities of beings arise from Me alone.","10.5. Non-violence, equality, contentment, penance, charity. The various feelings of such creatures as fame and infamy are manifested from me only."
"10.6 The seven great sages, the ancient four and also the Manus, possessed of powers like Me (on account of their minds being fixed on Me), were born of (My) mind; from them are these creatures born in this world.","10.6. The seven Maharishis, the four (Sankadis) of the past and the (fourteen) Manus, these have arisen from my resolution under my influence, whose subjects are in this world (world)."
10.7 He who in truth knows these manifold manifestations of My Being and (this) Yoga-power of Mine becomes established in the unshakable Yoga; there is no doubt about it.,"..10.7.. The man who knows this My Vibhuti and Yoga from the essence, he becomes equipped with Avikampa Yoga (i.e. motionless meditation yoga), there is no doubt in this."
"10.8 I am the source of all; from Me everything evolves; understanding thus, the wise, endowed with meditation, worship Me.","10.8. I am the dominant place of all; It is only from me that the whole world attains development, knowing this the wise people worship me with full devotion."
"10.9 With their mind and their life wholly absorbed in Me, enlightening each other and ever speaking of Me, they are satisfied and delighted.","10.9. The devotees who fix their mind on Me and surrender their lives (senses) to Me, always become satisfied and happy while making each other aware of Me and talking about Me."
"10.10 To them who are ever steadfast, worshipping Me with love, I give the Yoga of discrimination by which they come to Me.","..10.10.. To those devotees who are daily united with me and worship me with love, I give the 'Buddhiyoga' by which they attain me."
"10.11 Out of mere compassion for them, I, dwelling within their Self, destroy the darkness born of ignorance by the luminous lamp of knowledge.","..10.11.. To show favor to them, I reside in their hearts and destroy the darkness born of ignorance with the lamp of luminous knowledge."
"10.12 Arjuna said  Thou art the Supreme Brahman, the supreme abode (or the supreme light), the supreme purifier, eternal, divine Person, the primeval God, unborn andn omnipresent.","..10.12.. Arjun said - You are the ultimate Brahma, the ultimate abode and the ultimate pure; The eternal divine man, the progenitor of gods, is birthless and omnipresent."
"10.13 All the sages have thus declared Thee, as also the divine sage Narada; so also Asita, Devala and Vyasa; and now Thou Thyself sayest so to me.","10.13. This is what all the sages say to you;  Similarly, Devarshi Narad, Asit, Deval Rishi and Vyas and you yourself also say about me."
"10.14 I believe all this that Thou sayest to me to be true, O Krishna; verily, O blessed Lord! neither the gods nor the demons know Thy manifestation (origin).","..10.14.. Hey Keshav! Whatever you say about me, I consider it all to be true. Oh Lord, neither the gods nor the demons know your (real) form."
Swami Sivananda did not comment on this sloka,..10.15.. Hey Purushottam! Hey ghostly spirit! Hey Bhootesh! O God of gods! O Lord of the world! You yourself know yourself.
"10.16 Thou shouldst indeed tell, without reserve, of Thy divine glories by which Thou existest, pervading all these worlds. (None else can do so.)","..10.16.. You are the only one who is qualified to call those divine personalities of yours as essence, through which you have pervaded all these worlds."
"10.17 How shall I, ever meditating, know Thee, O Yogin? In what aspects or things, O blessed 
Lord, art Thou to be thought of by me?","..10.17.. Oh Yogeshwar! How can I know you by thinking continuously, and oh Lord! In what ways are you worthy of being contemplated by me?"
"10.18 Tell me again in detail, O Krishna, of Thy Yogic power and glory; for I am not satiated with what I have heard of Thy life-giving and nectar-like speech.","..10.18.. Hey Janardan! Tell me again in detail about your yogic power and glory, because I am never satisfied while listening to your nectar-filled words."
"10.19 The Blessed Lord said  Very well! Now I will declare to thee My divine glories in their prominence, O Arjuna; there is no end to their detailed description.","..10.19.. Shri Bhagwan said - Sir, now I will tell you about my divine personalities with priority. O great Kurus, there is no end to my expansion."
"10.20 I am the Self, O Gudakesa, seated in the hearts of all beings; I am the beginning, the middle and also the end of all beings.","..10.20.. O Gudakesh (sleeping one)! I am the soul of everyone located in the heart of all beings and I am also the beginning, middle and end of all beings."
"10.21 Among the (twelve) Adityas, I am Vishnu; among luminaries, the radiant sun; I am Marichi among the (seven or forty-nine) Maruts; among stars the moon am I.",..10.21.. I am Vishnu among the (twelve) Adityas and Anshuman Surya among the lights; I (forty-nine) am Marichi among the Maruts (wind gods) and among the constellations I am Shashi (Moon).
10.22 Among the Vedas I am the Sama-Veda; I am Vasava among the gods; among the senses I am the mind; and I am intelligence among living beings.,"..10.22.. I am Samaveda among the Vedas, I am Vasava (Indra) among the gods; I am the mind in the senses and consciousness (knowledge power) in the living beings."
"10.23 And, among the Rudras I am Sankara; among the Yakshas and Rakshasas, the Lord of wealth (Kubera); among the Vasus I am Pavaka (fire); and among the (seven) mountains I am the Meru.","..10.23.. I am Shankar among the (eleven) Rudras and among the Yakshas and demons I am Kuber (Vittesha), the lord of wealth; (8) I am Agni among the Vasus and I am Meru among the peaked mountains."
"10.24 And, among the household priests (of kings), O Arjuna, know Me to be the chief, Brihaspati; among the army generals I am Skana; among lakes I am the ocean.
'",..10.24.. Hey Parth! Know me to be Brihaspati among the priests; I am Skanda among commanders and the ocean among reservoirs.
10.25 Among the great sages I am Bhrigu; among words I am the one syllable (Om); among sacrifices I am the sacrifice of silent repetition; among the immovable things I am the Himalayas.,..10.25.. I am Bhrigu among the Maharishis and Omkar in words. I am the Japayajna among yagyas and Himalaya among immovables.
"10.26 Among all the trees ( I am) the Peepul; among the divine sages, I am Narada; among Gandharvas, Chitraratha; among the perfected, the sage Kapila.",..10.26.. I am Ashvattha (Peepal) among all the trees and Narad among the Devarshis; I am Chitrarath among the Gandharvas and Kapil Muni among the accomplished men.
"10.27 Know Me as Ucchaisravas born of nectar, among horses; among lordly elephants (I am) the Airavata; and, among men, the king.","..10.27.. Among the horses, know me only, the horse named Uchchaishrava born from nectar, Airavata among the elephants and the king among humans."
"10.28 Among weapons I am the thunderbolt; among cows I am the wish-fulfilling cow called Kamadhenu; I am the progenitor, the god of love; among serpents I am Vasuki.","..10.28.. I am the thunderbolt among weapons and Kamadhenu among the cows, I am Kandarpa (Kamadev) the cause of creation of people and I am Vasuki among the snakes."
10.29 I am Ananta among the Nagas; I am Varuna among water-deities; Aryaman among the Manes I am; I am Yama among the governors.,..10.29.. I am Anant (Sheshnag) among the snakes and Varun among the water gods; I am Aryama among the ancestors and Yama among those who regulate.
